{
  "patient_info": {
    "name": "Cuebas Fernando",
    "test_date": "10/09/202",
    "gender": "Male",
    "age": 57,
    "weight_kg": 113,
    "height_cm": 175
  },
  "core_scores": {},
  "caloric_data": {
    "rmr": 500
  },
  "metabolic_data": {
    "rmr": 500
  },
  "heart_rate_data": {},
  "all_text": [
    "P N O E - View Ergometry 11/10/25, 1:34 PM\nPNOE Ergometry results\nSubject~ Measurement\nName Cuebas Fernando Status v Closed\nGender Male (57) Date 10/09/202S 09:21 :36\nWeight 113 kg Duration 11' (72 breaths)\nHeight 175 cm Protocol (Ji)G row -RMR (/Protocol/Edit?id=819c33a7-621 S-4d47-aa22-a,\nExercise Frequency 4 times a week Device PNOE 2516-338 / Absorber\nExercise Goal Performance (Endurance Sports) Granular HR 637\nReport Type RMR\nRMR\n500\n~00\nE\n'-\nE300\n'-\"\nN\n&oo\n>\ncxl\nNlOO\n0\n>\n0\n50 100 150 200 250 300 350 400 450 500 550 600\nTime (sec)\n75\n\u25a0[02] Hea Rate\n70\nE\n0.\n.0\n'o-\" :: 65\nI\nso 100 150 200 250 300 350 400 450 500 550 600\nTime (sec}\n0.9\n~\n00.7\n0::\n~ 0.6\n0.5\n50 100 150 200 250 300 350 400 450 500 550 600\nTime (sec)\nhitps:f/platform.mypnoe.com/ergometry/viewergometryp?data=ec01a ...d e-0000-000000000000/0/0//82dca80f-f604-08dd-0000-000000000000 Page 1 of 4"
  ]
}